{"anchor":{"fingerprint_sha256":"0000000000000000000000000000000000000000000000000000000000000000","host":"_wakir-ftd.wakir.dev","kind":"dns-txt"},"document_signature":{"alg":"Ed25519","kid":"ftd-root-1","signature":"2b24c3c93290c2c27461cb700b2b81d894d69c8021a4b49530a2c09059c15bcd232b2a6c96b0670941792e5cabca2ba14d4d700bb9f5311ea7ee6b6b45a4440d"},"domain":"wakir.dev","expires":"2027-05-07T00:00:00Z","ftd_root_pubkey":"c6822637c7d310ec57627be00ba259d253749f4aaf644470cffbe53a35f73242","id":"did:web:wakir.dev:ftd:v1","issued_at":"2026-05-07T00:00:00Z","issuer_keys":[{"alg":"Ed25519","kid":"federated-issuer-1","public_key":"c8efd3cbfb88ae70d094f1b68da5587a65b5bc05d1aedaa7f03832fbf64ab63c","purpose":"biscuit-root","valid_from":"2026-05-07T00:00:00Z","valid_until":"2027-05-07T00:00:00Z"}],"wakir_ftd":"0.1.0"}
